{
  "identity_schema": "arrow/kernel-sweep/v1",
  "description": "One Arrow tree measured across kernel versions: the kernel is the axis, the code is held fixed.",
  "axis": [{ "path": "/coordinates/environment/system/os/kernel", "order": "version" }],
  "default": "match",
  "paths": {
    "/provenance/subject_tree": "match",
    "/coordinates/environment/system/hostname": "ignore",
    "/coordinates/environment/system/os": "ignore",
    "/coordinates/environment/system/libc": "ignore",
    "/coordinates/environment/system/cpu": "ignore",
    "/coordinates/environment/system/gpu": "ignore",
    "/coordinates/environment/system/firmware": "ignore",
    "/coordinates/environment/system/container": "ignore",
    "/coordinates/environment/system/process/cgroup": "ignore"
  }
}
